{
  "schema_version": "1.0.0",
  "report_metadata": {
    "project_id": "PRJ-001",
    "project_name": "Spectrum Assessment Support",
    "report_type": "weekly_engineering_report",
    "reporting_period": {
      "start_date": "2026-03-16",
      "end_date": "2026-03-22",
      "week_label": "2026-W12"
    },
    "engineer": {
      "engineer_id": "ENG-01",
      "name": "Engineer Name",
      "discipline": "RF / Software / Analysis"
    },
    "template_id": "WER-v1",
    "template_version": "1.0.0"
  },
  "raw_intake": {
    "source_type": "excel_form",
    "submitted_at": "2026-03-24T13:30:00Z",
    "free_text_summary": "Worked on propagation model review, document triage, and validation scripts.",
    "notes": [
      "Reviewed P.530 references",
      "Updated validation logic",
      "Prepared monthly tracker inputs"
    ]
  },
  "structured_input": {
    "activities": [
      {
        "activity_id": "A-001",
        "category": "technical_analysis",
        "title": "Propagation model review",
        "description": "Reviewed model assumptions and implementation gaps.",
        "hours": 6.5,
        "deliverables_touched": ["D2.2", "D3.1"],
        "evidence_refs": ["DOC-01", "FILE-03"]
      },
      {
        "activity_id": "A-002",
        "category": "coding",
        "title": "Validation script update",
        "description": "Refined input checks and test logic.",
        "hours": 5.0,
        "deliverables_touched": ["VALIDATION-SUITE"],
        "evidence_refs": ["REPO-COMMIT-17"]
      }
    ],
    "documents_reviewed": [
      {
        "doc_id": "DOC-01",
        "title": "ITU-R P.530-19",
        "document_type": "technical_reference",
        "review_purpose": "gap review",
        "review_depth": "partial",
        "evidence_ref": "NOTE-12"
      }
    ],
    "meetings": [
      {
        "meeting_id": "M-001",
        "title": "Internal technical sync",
        "date": "2026-03-20",
        "participants": ["Engineer Name", "Manager Name"],
        "purpose": "Review status and next steps",
        "outcomes": ["Need stricter input validation", "Document tracker must be updated"]
      }
    ],
    "risks_issues_actions": {
      "risks": [
        {
          "risk_id": "R-001",
          "description": "Ambiguity in source notes may reduce reporting quality.",
          "severity": "medium",
          "mitigation": "Use guided intake form and validation rules."
        }
      ],
      "issues": [
        {
          "issue_id": "I-001",
          "description": "Missing evidence link for one activity.",
          "status": "open"
        }
      ],
      "actions": [
        {
          "action_id": "ACT-001",
          "description": "Request missing evidence reference from engineer.",
          "owner": "Engineer Name",
          "due_date": "2026-03-25"
        }
      ]
    },
    "next_steps": [
      "Finalize document tracker",
      "Run full validation suite",
      "Draft executive summary"
    ]
  },
  "validation": {
    "status": "PASS_WITH_WARNINGS",
    "completeness_score": 92,
    "consistency_score": 88,
    "warnings": [
      "One activity has no strong evidence reference"
    ],
    "errors": []
  },
  "workflow": {
    "draft_status": "generated",
    "review_status": "pending_review",
    "approval_status": "not_approved"
  }
}
